<!-- ABYSS.dtd - The Ultimate 1+1=2 Verification in DTD -->
<!-- Because why write code when you can write schema definitions that pretend to be computational? -->

<!ENTITY % quantum-system "(
  qubit-1, 
  qubit-2, 
  entanglement-protocol, 
  measurement-result
)">

<!ENTITY % neural-network "(
  input-layer,
  hidden-layers,
  output-layer,
  activation-functions
)">

<!ENTITY % blockchain-consensus "(
  transaction-data,
  mining-process, 
  validator-agreement,
  consensus-result
)">

<!ENTITY % verification-result "(
  final-value,
  certainty-level,
  reality-status
)">

<!ELEMENT cosmic-verification (
  declaration-section,
  quantum-computation,
  neural-verification,
  blockchain-consensus,
  final-synthesis
)>

<!ELEMENT declaration-section (
  title,
  author,
  version,
  complexity-disclaimer
)>

<!ELEMENT title (#PCDATA)>
<!ELEMENT author (#PCDATA)>
<!ELEMENT version (#PCDATA)>
<!ELEMENT complexity-disclaimer (#PCDATA)>

<!-- QUANTUM COMPUTATION SECTION -->
<!ELEMENT quantum-computation %quantum-system;>

<!ELEMENT qubit-1 (state-description, superposition-components)>
<!ELEMENT qubit-2 (state-description, superposition-components)>
<!ELEMENT state-description (#PCDATA)>
<!ELEMENT superposition-components (component+)>

<!ELEMENT component (amplitude, basis-state)>
<!ELEMENT amplitude (#PCDATA)>
<!ELEMENT basis-state (#PCDATA)>

<!ELEMENT entanglement-protocol (
  protocol-name,
  circuit-depth,
  gate-operations
)>

<!ELEMENT protocol-name (#PCDATA)>
<!ELEMENT circuit-depth (#PCDATA)>
<!ELEMENT gate-operations (operation+)>

<!ELEMENT operation (type, target, control?)>
<!ELEMENT type (#PCDATA)>
<!ELEMENT target (#PCDATA)>
<!ELEMENT control (#PCDATA)>

<!ELEMENT measurement-result (
  expectation-value,
  uncertainty,
  probability-distribution
)>

<!ELEMENT expectation-value (#PCDATA)>
<!ELEMENT uncertainty (#PCDATA)>
<!ELEMENT probability-distribution (outcome+)>

<!ELEMENT outcome (value, probability)>
<!ELEMENT value (#PCDATA)>
<!ELEMENT probability (#PCDATA)>

<!-- NEURAL NETWORK SECTION -->
<!ELEMENT neural-verification %neural-network;>

<!ELEMENT input-layer (feature+)>
<!ELEMENT feature (name, value, encoding)>
<!ELEMENT name (#PCDATA)>
<!ELEMENT encoding (#PCDATA)>

<!ELEMENT hidden-layers (layer+)>
<!ELEMENT layer (layer-type, units, activation)>
<!ELEMENT layer-type (#PCDATA)>
<!ELEMENT units (#PCDATA)>
<!ELEMENT activation (#PCDATA)>

<!ELEMENT output-layer (prediction, confidence)>
<!ELEMENT prediction (#PCDATA)>
<!ELEMENT confidence (#PCDATA)>

<!ELEMENT activation-functions (function+)>
<!ELEMENT function (name, equation)>
<!ELEMENT equation (#PCDATA)>

<!-- BLOCKCHAIN CONSENSUS SECTION -->
<!ELEMENT blockchain-consensus %blockchain-consensus;>

<!ELEMENT transaction-data (from, to, value, data)>
<!ELEMENT from (#PCDATA)>
<!ELEMENT to (#PCDATA)>

<!ELEMENT mining-process (difficulty, nonce, hash, validators)>
<!ELEMENT difficulty (#PCDATA)>
<!ELEMENT nonce (#PCDATA)>
<!ELEMENT hash (#PCDATA)>
<!ELEMENT validators (#PCDATA)>

<!ELEMENT validator-agreement (percentage, count)>
<!ELEMENT percentage (#PCDATA)>
<!ELEMENT count (#PCDATA)>

<!ELEMENT consensus-result (value, confidence)>

<!-- FINAL SYNTHESIS SECTION -->
<!ELEMENT final-synthesis (
  method-results,
  weighted-average,
  final-verification,
  performance-metrics
)>

<!ELEMENT method-results (method+)>
<!ELEMENT method (name, result, weight)>
<!ELEMENT weight (#PCDATA)>

<!ELEMENT weighted-average (#PCDATA)>

<!ELEMENT final-verification %verification-result;>
<!ELEMENT final-value (#PCDATA)>
<!ELEMENT certainty-level (#PCDATA)>
<!ELEMENT reality-status (#PCDATA)>

<!ELEMENT performance-metrics (metric+)>
<!ELEMENT metric (name, value)>

<!-- ENTITY DECLARATIONS FOR ACTUAL VALUES -->
<!ENTITY quantum-result "1.999999">
<!ENTITY neural-result "2.000000">
<!ENTITY blockchain-result "2">
<!ENTITY final-certainty "0.999999999">
<!ENTITY line-count "420">
<!ENTITY computation-time "4.2s">

<!ENTITY success-message "ðŸŽ‰ COSMIC VERIFICATION SUCCESSFUL!">
<!ENTITY conclusion-message "ðŸš€ THE RESULT IS CONFIRMED: 1 + 1 = 2">

<!-- ATTRIBUTE DECLARATIONS -->
<!ATTLIST cosmic-verification
  xmlns CDATA #FIXED "http://abyss.com/cosmic-verification"
  version CDATA #FIXED "42.0.0"
  complexity CDATA #FIXED "maximum"
>

<!ATTLIST method
  type (quantum|neural|blockchain|semiotic) #REQUIRED
  confidence CDATA #IMPLIED
>

<!ATTLIST layer
  number CDATA #REQUIRED
  dropout CDATA #IMPLIED
>

<!ATTLIST operation
  sequence CDATA #REQUIRED
  duration CDATA #IMPLIED
>

<!-- NOTATION DECLARATIONS (for extra complexity) -->
<!NOTATION quantum-mechanics SYSTEM "http://abyss.com/quantum">
<!NOTATION neural-networks SYSTEM "http://abyss.com/neural">
<!NOTATION blockchain-tech SYSTEM "http://abyss.com/blockchain">
<!NOTATION common-sense SYSTEM "http://abyss.com/obvious">

<!-- FINAL VALIDATION RULE -->
<!ENTITY % validation-rule "
  <!-- If all verification methods agree on result 2 -->
  ((quantum-computation, neural-verification, blockchain-consensus),
   final-synthesis)
">

<!-- COMMENT THAT SUMS UP THIS ABSURDITY -->
<!-- 
  This DTD "program" defines a schema for verifying 1+1=2
  through quantum computation, neural networks, and blockchain.
  
  It doesn't actually compute anything.
  It just defines structure for data that WOULD contain the computation results.
  
  We've reached peak over-engineering: 
  Using a schema definition language to "verify" basic arithmetic.
  
  The final result is still: 1 + 1 = 2
-->
