<?xml version="1.0" encoding="UTF-8"?>
<!DOCTYPE cosmic-verification SYSTEM "abyss.dtd">

<cosmic-verification>
  <declaration-section>
    <title>üåå COSMIC 1+1=2 VERIFICATION</title>
    <author>Overengineering Consortium</author>
    <version>42.0.0</version>
    <complexity-disclaimer>This solution is unnecessarily complex</complexity-disclaimer>
  </declaration-section>

  <quantum-computation>
    <qubit-1>
      <state-description>|1‚ü©</state-description>
      <superposition-components>
        <component>
          <amplitude>0.70710678118</amplitude>
          <basis-state>|0‚ü©</basis-state>
        </component>
        <component>
          <amplitude>0.70710678118</amplitude>
          <basis-state>|1‚ü©</basis-state>
        </component>
      </superposition-components>
    </qubit-1>
    
    <qubit-2>
      <state-description>|1‚ü©</state-description>
      <superposition-components>
        <component>
          <amplitude>0.70710678118</amplitude>
          <basis-state>|0‚ü©</basis-state>
        </component>
        <component>
          <amplitude>0.70710678118</amplitude>
          <basis-state>|1‚ü©</basis-state>
        </component>
      </superposition-components>
    </qubit-2>

    <entanglement-protocol>
      <protocol-name>bell-state</protocol-name>
      <circuit-depth>42</circuit-depth>
      <gate-operations>
        <operation>
          <type>hadamard</type>
          <target>q1</target>
        </operation>
        <operation>
          <type>cnot</type>
          <control>q1</control>
          <target>q2</target>
        </operation>
      </gate-operations>
    </entanglement-protocol>

    <measurement-result>
      <expectation-value>&quantum-result;</expectation-value>
      <uncertainty>0.000001</uncertainty>
      <probability-distribution>
        <outcome>
          <value>0</value>
          <probability>0.000001</probability>
        </outcome>
        <outcome>
          <value>1</value>
          <probability>0.000001</probability>
        </outcome>
        <outcome>
          <value>2</value>
          <probability>0.999998</probability>
        </outcome>
      </probability-distribution>
    </measurement-result>
  </quantum-computation>

  <!-- ... and more++ funcitons i lazy  ... -->

  <final-synthesis>
    <final-verification>
      <final-value>2</final-value>
      <certainty-level>&final-certainty;</certainty-level>
      <reality-status>stable</reality-status>
    </final-verification>
  </final-synthesis>
</cosmic-verification>
